Content Title,Content Description,Content Type,Content Last Watched Date (if viewed),Content Completed At (if completed),Content Saved,Notes taken on videos (if taken),
Leading with a Growth Mindset,"<p>As a leader, developing a growth mindset is key to your success. The way you overcome challenges, build relationships, and cultivate a positive culture all stems from your mental agility. In this course, instructor Karen Allen shows you how to strengthen your greatest asset: your mindset. As she explains, your mindset is how you see life and forms the basis for how you live and treat others. Karen illustrates how leaders who operate with a growth mindset create a thriving work environment that fosters more innovation, collaboration, and compassion. Throughout the course, she shows how to focus your mindset to make your brain stronger, and gives you the skills and techniques to help you build a growth mindset to improve your communication, develop other members of your team, and build a culture of trust. </p><p>This course is part of a <a href=""https://www.linkedin.com/learning/paths/succeeding-as-a-mid-career-manager-professional-certificate-by-linkedin-learning-24764049"" target=""_blank"">Professional Certificate</a> from LinkedIn Learning.</p>",Course,2021-08-18 20:49 UTC,N/A,true,N/A,
Presentation Tips for Pitching to Investors,"Landing a meeting with investors is a big opportunity—and a key test of your business. Investors ask tough questions. The answers can define your future. This course is all about preparing and delivering a rock-solid pitch that makes people want to invest in your company. Learn how to define the unique benefits of your product, describe your business model, and tell the story of your “why.” Instructor Jessica Chen—a public speaking and media relations consultant—then introduces tips for the actual presentation, including responding to your audience, answering questions, and being authentic. She leaves you with a final pitch checklist that will ensure you have all the elements of your pitch nailed down before the big day.",Course,2021-07-31 21:30 UTC,N/A,false,N/A,
"Diversity, Inclusion, and Belonging","<p>Diversity is having a culture that values uniqueness: people of different backgrounds, cultures, genders, and races. Inclusion means inviting diverse groups to take part in company life. If you're tuned into conversations about HR, you've probably heard these terms before. But there's a third critical piece: belonging. It's belonging that makes each individual feel accepted for who they are. Explore the diversity, inclusion, and belonging (DIB) approach, and discover how to activate it in your organization. Join HR luminary Pat Wadors as she explains how to drive the conversation on DIBs, hire and retain diverse talent, listen to employees, and integrate DIBs into your employee lifecycle. Managers and executives should tune in for special tips on embedding DIBs in the employee experience.</p><p>This course is part of a <a href=""https://www.linkedin.com/learning/paths/succeeding-as-a-new-manager-professional-certificate-by-linkedin-learning?u=104"" target=""_blank"">Professional Certificate</a> from LinkedIn Learning.</p>",Course,2021-09-12 18:14 UTC,N/A,false,N/A,
Creating a Product-Centric Organization,"A lot of companies begin with the success of their first product. And a slew of factors—from good timing to opportune professional connections—can help a company take off. But to achieve staying power, companies must continue to create innovative products that customers love. In this course, instructor Jay Clouse shares strategies that can help you cultivate a product-centric organization by fine-tuning how you organize people, implement processes, and create your company's culture. Learn how to construct effective product teams, inspire your colleagues by creating a strong product vision and strategy, build a data-driven culture, measure your performance using key performance indicators, and more.",Course,2021-07-29 18:52 UTC,N/A,true,N/A,
Empathy for Sales Professionals,"Empathy is a key skill for creating deeper connections and relationships—the building blocks of sales. With empathy, salespeople can achieve a deeper understanding of what prospects are going through and connect better with existing customers. In this course, workforce innovation specialist Sophie Wade quantifies the effect of empathy on sales and shows sales leaders how to incorporate empathy into the management and training of sales teams. Learn how to use empathy to distribute responsibility and improve team performance, and help your reps deepen customer relationships and increase sales. Sophie also shows how to improve empathy on a division-wide level by creating conditions that help an open-minded, empathetic organization thrive.",Course,2021-08-23 18:52 UTC,N/A,false,N/A,
Executive Presence on Video Conference Calls,"Learn how to shine on video conference calls. Communication consultant Jessica Chen provides expert advice to look and sound confident, collected, and smart on your next conference call or video presentation. Discover how to prepare your material, how to contribute to the call, and how to incorporate engaging visuals. Get body language, posture, and wardrobe tips to make a powerful impression. Finally, learn the technical details to building a mini ""studio"" for conducting calls, including choosing a webcam, lighting yourself, and placing a microphone for quality sound. <br><br>Note: This course was featured in <i>Market Watch</i>, <i>Inc.</i>, <i>Fortune</i>, <i>Forbes</i>, and <i>Entrepreneur</i>.",Course,N/A,N/A,true,N/A,
Stepping Up Your Webcam Video Presence,"Nearly everyone has a webcam, but many people don’t put the effort into enhancing their webcam video presence. But with just a few relatively easy and inexpensive tweaks, you can capture well-composed, well-lit shots with great audio using the humble webcam. In this course, senior staff instructor Ashley Kennedy shows you how to represent your best self in meetings, as well as presentations, trainings, vlogs, interviews, demos, Q&As, and other types of web videos. Learn basic strategies for optimizing your system and your webcam, staging and lighting your shot, capturing high-quality audio, scripting and rehearsing for big-stakes webcam presentations, and more.",Course,2021-07-30 17:53 UTC,N/A,false,N/A,
Critical Thinking for Better Judgment and Decision-Making,"The pace of change and volume of information we encounter in daily life make it hard to think through decisions. Instead, people often rely on biases and rules of thumb, which trap them into drawing faulty conclusions. The most successful teams use critical thinking—objective and rational analysis—to illuminate the wisest conclusions. This course prepares leaders to hone the critical thinking skills of their entire organization. Learn how to upgrade critical thinking to avoid deceiving fallacies, spot misleading cognitive biases, craft better arguments, hone judgment, and improve decision-making. Instructor Becki Saltzman teaches skills that will improve how your company or team innovates, tackles challenges, and responds to change.",Course,2021-08-09 14:07 UTC,N/A,false,N/A,
Understanding the Impact of Deepfake Videos,"Imagine not being able to trust what you see or hear when you watch a video online. Deepfakes are manipulated media—video or audio—where a person has been replaced with someone else's likeness and made to appear as if they said or did something that never happened. Deepfake videos use artificial intelligence and can appear very convincing, even to a trained eye. When used to mislead audiences, deepfake videos can be disastrous. However, they can have useful benefits too—like offering AI-assisted video reshoots. In this introductory course, senior staff instructor Ashley Kennedy offers a useful introduction to the dangers and benefits of deepfake videos. She also provides a high-level overview of deepfake technology and puts forward some tools to identify deepfake videos, as well as suggestions for what to do when you suspect or spot a deepfake video.",Course,2021-11-19 05:35 UTC,N/A,false,N/A,
Guy Kawasaki on Turning Life Wisdom into Business Success,"Get career advice from a real ""wise guy."" In this course, based on his book <i>Wise Guy</i>, one of the world's leading corporate evangelists, Guy Kawasaki, talks about how he built his career. Learn how he landed his first real job in the jewelry business—which turned out to be surprisingly useful training for the tech world. Find out why some of the riskiest moves he made at Apple—disparaging a potential partner and trading jabs with Steve Jobs—paid off. Guy also reveals how taking up surfing at the age of 62 sparked a new passion. In total, Guy covers everything from moral values to business skills to parenting. As he writes, “I hope my stories help you live a more joyous, productive, and meaningful life. If <i>Wise Guy</i> succeeds at this, then that’s the best story of all.”<br><br>

This course was created by <a href=""https://genconnectu.com/"" target=""_blank"">genconnectU</a>. We are pleased to offer this training in our library.",Course,2021-05-13 23:23 UTC,N/A,false,N/A,
Becoming an AI-First Product Leader,"Artificial intelligence is changing the world, powering everything from advertising to education. Becoming a successful product leader is anchored to an AI-first mindset—and you can't lead what you don't understand. Join Tomer Cohen in this AI primer for product leaders. Learn the current use cases for AI and see how AI is impacting your role and popular products in the marketplace, including those at LinkedIn. Explore the three components of AI: the algorithms, the data, and the objective. Tomer also explains how to adopt AI product principles, shifting the mindset of your entire organization. The course wraps up with a discussion of the future of AI and its impact on product leaders like you.",Course,2021-05-15 04:24 UTC,N/A,false,N/A,
Excel VBA: Process Modeling (2016),"Excel power users: Learn how to use Excel and VBA to create and run simulations on business processes for customer flow, queuing, and manufacturing. Visual Basics for Applications exponentially extends Excel's power, allowing you to control process flow and logic and add custom classes and variables. In these exercise-centered tutorials, Curt Frye builds simulations of increasing complexity, which model the flow of customers through checkout stations. You'll learn how to calculate arrival and transaction times, add customers, and increase individual station capacity, and find out when you need to add more stations. At the end of the course, Curt shows how to convert output to an Excel table and analyze the results of your simulation.",Course,2018-06-27 22:01 UTC,N/A,false,N/A,
Learning to Write Marketing Copy,"Copy is the heart and soul of almost every marketing endeavor. Get a great foundation for all your campaigns with this course. Ian Lurie shows how to write copy that tells your story and sells your product or brand. Learn about the different types of copywriting, the benefits of drafting on paper (yes, paper!), observing general rules, writing headlines, selling the page, and rewriting existing copy to optimize it for different outlets and platforms. Ian shows how to manage a copyediting team, a brand voice, and an editorial calendar.",Course,2021-05-06 11:11 UTC,N/A,false,N/A,
CONTENT METADATA NO LONGER EXISTS - urn:li:lyndaCourse:2880066,CONTENT METADATA NO LONGER EXISTS - urn:li:lyndaCourse:2880066,Course,2022-07-01 23:36 UTC,N/A,false,N/A,
Transforming Business with AI Agents: Autonomous Efficiency and Decision-Making,"Unlock the power of AI agents to revolutionize your business. In this course, best-selling author and thought leader Charlene Li delves into the ever-evolving landscape of AI, providing a clear, comprehensive introduction to autonomous, adaptive AI agents. You’ll learn how to define and identify AI agents and how they differ from other AI products. Charlene outlines AI agents’ potential to boost productivity and enhance decision-making, as well as how agents can automate complex workflows. Along the way, explore the critical challenges of trust, privacy, common ethical concerns, and key considerations for evaluating the use of AI agents in your organization.",Course,2025-07-09 12:44 UTC,N/A,false,N/A,
Reid Hoffman and Chris Yeh on Blitzscaling,"Blitzscaling is a growth strategy that prioritizes speed over efficiency in the face of uncertainty. Those bold enough to adopt it must break free from the confines of business school logic to take uncalculated risks that could just as easily lead to abject failure as rapid-fire growth. In this course, LinkedIn founder Reid Hoffman and entrepreneur Chris Yeh break down when and how entrepreneurs and other business leaders should leverage this tactic to get ahead. Reid and Chris—who literally wrote the book on this topic in 2018's <i>Blitzscaling</i>— explain how, despite the potential pitfalls, blitzscaling practices are often the key to scaling massive companies. They share examples of successful blitzscaling, explain how to blitzscale within a larger organization, and more.",Course,2021-06-06 04:30 UTC,N/A,false,N/A,
Building Resilience as a Leader (2019),"Research tells us that resilience is one of the key attributes of successful leaders. Resilience can help you face challenges, navigate obstacles, and thrive in your role. But it can also help you lead your team and your business to bigger and better results. In this course, psychologist and executive coach Gemma Leigh Roberts helps you develop a resilient mindset, a resilient team, and a resilient organization that can weather risk and change. The tips and strategies Gemma offers are approachable and actionable—designed for busy leaders who need an extra edge to survive and thrive in challenging times.",Course,2021-08-29 02:35 UTC,N/A,false,N/A,
"The Persuasion Code, Part 2: The Neuroscience of Selling Remotely","While virtual sales calls have steadily increased for many reasons—reduced travel costs, improving technology, and most recently health and safety considerations—the fact remains, people simply hate virtual meetings. Factors like fatigue and distrust of the presenter lead to declines in attention and engagement, which reduce your chances of closing a deal. In this course, neuromarketing expert Patrick Renvoise shows you how to tackle the challenges around selling virtually by understanding the brain of your audience. Patrick covers the reasons people hate video calls, why they generate so much fatigue, and why it’s so hard to establish trust over a virtual meeting. He also guides you through what to say and do on video sales calls, and shows how a little knowledge of the primal brain can help you communicate more persuasively in the virtual world.",Course,2021-09-03 04:47 UTC,N/A,false,N/A,
Developing Executive Presence,"Learn to project self-confidence, clarity, and credibility even under conditions of stress, pressure, and uncertainty. In this course, John Ullmen, PhD, a professor from the UCLA Anderson School of Management, shares key research insights and step-by-step methods he uses to coach leaders around the world to develop executive presence. He outlines the four key factors that drive executive presence, and the specific actions that make them work for you.  He also explains the difference between internal and external presence, and how to enhance both to increase your self-assurance and self-possession. He addresses how to do all of this without being fake or feeling inauthentic, and how to be ""fully present, persistently.""",Course,N/A,N/A,true,N/A,
Google Analytics 4 (GA4) Essential Training (2021),"Google Analytics 4 provides the means to track, analyze, and report on the visitors to your site and app—who they are and what they do. This course walks you through the first major revision in years to the de facto standard in analytics in years that includes tons of new features and powerful machine learning. With over 15 years on the platform and thousands of enterprise client engagements, industry veteran Corey Koberg covers how to best use this leading analytics tool to better understand who your digital customers are, how they found you, and how they engage with your site or app once they get there. Corey covers the platform's out-of-the-box functionality, from account creation to reporting fundamentals. He shares how to get, convert, and retain customers, manage user accounts, and more.",Course,2021-04-17 03:10 UTC,N/A,false,N/A,
Raspberry Pi: GPIO,"The Raspberry Pi talks to the outside world through the general-purpose input/output device, known as the GPIO. In this course, instructor Mark Niemann-Ross describes these pins and explains how to use the GPIO to control lights and motors, read data from sensors, and interact with the Internet of Things. It combines some hardware basics—such as identifying pins—with some programming in a variety of different languages, including Python, Scratch C++, Java, and Wolfram. By learning how to control input and output through GPIO pins, you'll open up a whole new world of electronics.",Course,2021-08-05 15:41 UTC,N/A,false,N/A,
Executive Guide to Predictive Modeling Strategy at Scale,"Building world-class predictive analytics solutions requires recognizing that the challenges of scale and sample size fluctuate greatly at different stages of a project. How do you know how much data to use? What is too little, what is too much? How does your infrastructure need to scale with the volume and demands of the project? This course walks step by step through the strategic and tactical aspects of determining how much data is needed to build an effective predictive modeling solution based on machine learning and what volumes of data are so large that they will create challenges. Instructor Keith McCormick reviews each stage—data selection, data preparation, modeling, scoring, and deployment—with scalability in mind, providing IT professionals, data scientists, and leadership with new insights, perspectives, and collaboration tools.<br><br>

Note: This course is software agnostic. The emphasis is on strategy and planning. Examples, calculations, and software results shown are for training purposes only.",Course,2021-05-18 02:37 UTC,N/A,false,N/A,
"Selling with Stories, Part 2: Stories Great Sales People Tell","Stories connect people. Telling a compelling and authentic story can solidify the relationship with your potential customer and win the sale. In this course, you can learn how to leverage the power of storytelling throughout the sales process. Paul Smith—the author of the best-selling book <i>Sell with a Story: How to Capture Attention, Build Trust, and Close the Sale</i>—covers the 25 most essential types of sales stories and shares formulas for developing your own specific narratives. Learn the stories you should tell from introduction to pitch to close, to capture buyer interest and build loyalty that lasts for the long term.<br><br>

Check out part one of the series for an introduction to selling with stories.",Course,2021-09-06 05:45 UTC,N/A,false,N/A,
"Management Excellence at Microsoft: Model, Coach, Care","The role of the manager is arguably one of the most important roles in any organization. Providing managers with clear expectations of their role, and how it aligns with the goals of the organization is critical. In this course, learn how Microsoft, a company recognized for its leadership excellence, grows and cultivates managers with a simple and easily applied framework: Model, Coach, Care.
Join Joe Whittinghill, Corporate Vice President, Talent, Learning, and Insights, along with Satya Nadella, Kathleen Hogan, Jason Zander, Jean-Philippe Courtois, and Amy Hood as they share the approach to manager excellence and keys to empowering managers to deliver success. Through the passion and dedication of these members, explore and reflect on management behaviors and how this framework can be applied to your practice as a manager.",Course,2022-03-26 05:40 UTC,N/A,false,N/A,
Product Management: Building a Product Strategy,"<p>Behind every successful product there is a clear strategic vision that takes both market and customer needs into account. Essentially, strategy is the set of choices a company makes in order to achieve its objectives. These choices include which products to develop, which market segments to focus on, how to differentiate, how to price, how to position, and more. Product leaders are the guardians of a company's strategy. While many people and teams can contribute to developing a strategy, product leaders need to articulate it and ensure that it's done in a way that is applicable for day-to-day decision-making. This course lays out how to develop an effective product strategy. Instructors Eldad Persky and Teg Grenager walk through a step-by-step process for creating a smart, thoughtful strategy, and explain how to build support for it. Plus, they go over how to maintain and implement your strategy.</p><p>This course is part of a <a href=""https://www.linkedin.com/learning/paths/aha-product-management-professional-certificate"" target=""_blank"">Professional Certificate</a> from Aha!.</p>",Course,2022-05-12 07:11 UTC,N/A,false,N/A,
Brad Feld on Validating Your Startup Idea,"So you have an idea for a business. Maybe you have lots of ideas, with lots of potential. How do you focus on the opportunity that is going to be the most successful and the best use of your time? Brad Feld is a serial entrepreneur turned investor, who has helped build 100s of companies over the last 30 years, including Techstars, his startup accelerator. In this course, he walks through the preliminary steps that any entrepreneur needs to follow to determine whether an idea has merit: whether it is significant, meaningful, and disruptive. He provides a framework to evaluate an idea and its risks—as well the costs of not pursuing the idea at all. He then explains, in detail, how to evaluate your opportunity, your product, your market, and your team. These steps lay the groundwork critical to a successful startup, resulting in a refined and well-researched idea that you, your partners, your customers, and potentials investors can all get behind.",Course,2021-08-17 19:20 UTC,N/A,true,N/A,
CONTENT METADATA NO LONGER EXISTS - urn:li:lyndaCourse:2815110,CONTENT METADATA NO LONGER EXISTS - urn:li:lyndaCourse:2815110,Course,2021-03-27 04:39 UTC,N/A,false,N/A,
Building a Superstar Brand,"Ever wondered what it takes to create your own brand and become a superstar along the way? Explore the value of storytelling, vision, and commitment in this course with World Wrestling Entertainment (WWE) chief brand officer Stephanie McMahon, as she shows you how to lead by example and leave a legacy in your wake. Learn key lessons from Stephanie’s hard-earned experiences and colorful tales of growing up in an entrepreneurial culture. The course shares valuable lessons on how to scale superstar partnerships, create a rich DEI culture, and build powerful fan relationships. Discover proven leadership strategies and tips that you can apply to your own venture or job. Throughout the course, Stephanie looks back on the sacrifices her parents made back when they were first promoting the WWE, growing it from nothing to superpower status, and inspiring millions around the world.<br><br>Note: This course was created by genconnectU. We are pleased to host this training in our library.",Course,2025-06-19 15:03 UTC,N/A,false,N/A,
Working with Difficult People,"<p>In every workplace, you're likely to encounter colleagues who are more difficult to work with than others. But before you rush to judgment, you should determine if and how you might be contributing to the situation, and what you can do to help.</p><p>In this course, join psychologist Dr. Emily Anhalt as she shows you how to navigate and communicate with people who you find challenging to deal with at work. Pause and reflect on your role in challenging work situations to uncover how empathy can help you work better with others. Emily shares strategies to respond to a wide variety of particularly challenging work situations, including with people whose behavior is negative, absent, competitive, and passive-aggressive. By the end of this course, you’ll be prepared with new skills and practical strategies to have an effective conversation with someone you find difficult to work with.</p><p>This course includes AI-powered Role Play. Role Play allows you to practice what you’ve learned in interactive simulations of real-world conversations.</p>",Course,2024-08-08 14:53 UTC,N/A,false,N/A,
Jeff Weiner on Leading like a CEO,"During Jeff Weiner's tenure as the CEO at LinkedIn, the company grew its membership base from 33 million to more than 690 million members, increased its revenue from $78 million to more than $7.9 billion, and expanded its team from 338 to over 16,000 employees. Throughout this period of remarkable growth, Jeff developed the company's values and created an organization where compassion is as revered as a healthy bottom line. In this course, Jeff shares his advice on what it takes to be a great leader, using a three-part framework of awareness, synthesis, and inspiration.<br><br>Learn about the importance of maintaining awareness of yourself, your team, your industry, and the world at large. Explore the topic of synthesis, which you achieve through developing your vision and values and by focusing on the most important priorities. Plus, learn about the role of inspiration in leadership, both in terms of being true to your own values and motivating others.",Course,2021-10-19 01:05 UTC,N/A,true,N/A,
