Introduction to Conversational AI,"<p>The use of AI in consumer and enterprise environments is exploding—and conversational AI is leading the way. Conversational AI is part of the intelligent automation spectrum of technologies used to digitize and transform operations, customer support, sales, and interactions with enterprise technologies. In this course, instructor Ian Barkin puts it all into context, situating conversational AI with its historical predecessor technologies and introducing the new technology stack: natural language processing, automatic speech recognition, and natural language understanding.</p><p>Explore the different types and benefits of conversational AI tools, with real-world examples drawn from enterprise experiences to highlight the ways in which this powerful technology has been deployed. From modern conversational AI channels and platforms to using AI chatbots in practice, by the end of this course, you’ll be equipped with highly sought-after skills to create better AI strategies for your teams.</p>",Course,2025-06-04 01:32 UTC,N/A,true,N/A,
How to Make Strategic Thinking a Habit (2020),"Working hard is important—but what's really critical is making sure you're working on the right things. That's what strategic thinking enables you to do. In this course, Dorie Clark shares frameworks and strategies to help you make strategic thinking a daily habit, so that you can make the best use of your time, energy, and effort at work. Discover how to set yourself up for success by carving out time for strategic thinking and adjusting your routine to spark more strategic thoughts. Get tactics for thinking strategically about the tasks and decisions that lie ahead of you, as well as how to revisit past decisions to glean valuable insights. Learn how to change the way you approach your to-do list and examine the root cause of problems to devise better solutions. Plus, Dorie explains how to consistently ask yourself the right questions, so that you don't get off track.",Course,2021-09-22 05:03 UTC,N/A,false,N/A,
Understanding and Supporting Asian Employees,"Underrepresented employees face unique challenges in the workplace, and understanding how to support them in these challenges is key to building a more inclusive workplace. Dr. Sarah-SoonLing Blackburn shows you how to get started. She begins with important terminology and breaks down the model minority myth. Dr. Blackburn explains why lived experiences matter in the workplace and goes over several issues that impact Asian employees at work. She points out that the Asian community is not a monolith and discusses ways to build a more meaningfully inclusive workplace culture. Dr. Blackburn covers several steps you can take to support Asian employees, such as making space for discussion and speaking up against bias. She concludes by describing how everyone has a role to play in creating inclusive workplace environments. 
<br><br>
Note: This course contains US-based examples and scenarios; however, learners around the world may still find the concepts applicable.",Course,2022-04-02 14:36 UTC,N/A,false,N/A,
After Effects 2020 New Features,"After Effects 2020 is here. Want to know how this new version will impact your motion graphics workflow? This course covers the latest upgrade, focused around the new, more powerful Content-Aware Fill. Discover how to remove an object, create a reference frame, and remove a logo on a smooth surface with this intelligent editing tool. Instructor Mark Christiansen provides practical tips to help you get the most from this forward-looking update.",Course,2021-07-29 00:08 UTC,N/A,false,N/A,
Excel: Sales Forecasting,"Creating accurate and reliable sales forecasts is essential for any sales leader. Professor Michael McDonald shows how to use Excel to forecast sales more effectively, beginning with a quick primer on sales forecasting, then explaining the business intelligence used in forecasting and the basics of regression analysis. Next, Michael shows how to use Excel to gather the necessary data for your forecast, how to cleanse data so that it will lead to more accurate forecasts, and how to interpret and explain the results of a regression forecast. The course concludes with a sample project, forecasting sales for a fictional restaurant. In this sample project, you’ll construct a data set, compute a simple set of forecast metrics, and construct an in-depth sales forecast. Finally, Michael explains the limitations of sales forecasting and how you can mitigate risk.",Course,2021-08-28 01:16 UTC,N/A,false,N/A,
Excel Essential Training (Microsoft 365) (2018),"Get up to speed with Microsoft Excel, the world's most popular spreadsheet program. Follow along with Excel expert Dennis Taylor as he demonstrates how to efficiently manage and analyze data with this powerful program. Learn how to enter and organize data, perform calculations with simple functions, and format the appearance of rows, columns, cells, and data. Other lessons cover how to work with multiple worksheets, build charts and PivotTables, sort and filter data, use the printing capabilities of Excel, and more.",Course,2021-09-18 15:42 UTC,N/A,false,N/A,
Technology for Product Managers,"Product managers must know technology basics. They need to have the vocabulary to speak to engineers, UX designers, and executives-and translate messages between these very different stakeholders. A product manager should know how the internet works, how front end differs from back end, what the major programming languages are, and why web and mobile developers are so in demand. This course provides an overview of the basics, including terminology and trends that will affect your work and collaboration with your team.<br><br>

Instructor Cole Mercer reviews the fundamental building blocks of modern software applications-from the web that connects all the working parts, to the data, users, and the build tools that developers use every day. He discusses the differences between desktop, web, and mobile development, and reviews the role of version control systems in deployment and release.",Course,2018-10-24 22:57 UTC,N/A,false,N/A,
Machine Learning & AI Foundations: Linear Regression,"<p>Having a solid understanding of linear regression—a method of modeling the relationship between one dependent variable and one to several other variables—can help you solve a multitude of real-world problems. Applications areas involve predicting virtually any numeric value including housing values, customer spend, and stock prices. This course reveals the concepts behind the most important linear regression techniques and how to use them effectively. Throughout the course, instructor Keith McCormick uses IBM SPSS Statistics as he walks through each concept, so some exposure to that software is assumed. But the emphasis will be on understanding the concepts and not the mechanics of the software. SPSS users will have the added benefit of being exposed to virtually every regression feature in SPSS.</p><p>Keith covers simple linear regression, explaining how to build effective scatter plots and calculate and interpret regression coefficients. He also dives into the challenges and assumptions of multiple regression and steps through three distinct regression strategies. To wrap up, he discusses some alternatives to regression, including regression trees and time series forecasting.</p>",Course,2024-08-07 21:16 UTC,N/A,false,N/A,
Python Essential Training (2018),"Due to its power and simplicity, Python has become the scripting language of choice for many large organizations, including Google, Yahoo, and IBM. A thorough understanding of Python 3, the latest version, will help you write more efficient and effective scripts. In this course, Bill Weinman demonstrates how to use Python 3 to create well-designed scripts and maintain existing projects. This course covers the basics of the language syntax and usage, as well as advanced features such as objects, generators, and exceptions. Learn how types and values are related to objects; how to use control statements, loops, and functions; and how to work with generators and decorators. Bill also introduces the Python module system and shows examples of Python scripting at work in a real-world application.",Course,2021-04-03 06:15 UTC,N/A,false,N/A,
Resume Makeover (2018),"If you're looking for your dream job, you have to be prepared to act quickly. That means having an incredible, on-point, ""you had us at hello"" resume. Is yours in working order? This course helps anyone make over a lackluster resume into something truly special. Career strategist and nationally recognized resume writer Jenny Foss takes you through the very same process she uses at JobJenny.com to develop resumes for her own clients. She teaches you how to condense years of experience into a compelling marketing document, address resume gaps and job hops, and choose the right format for the final document. She also explains how the hiring process works (from the perspective of both the resume scanning software and the human reviewer), so that when you do apply for that incredible new job, you have a real shot at landing an interview.",Course,2024-05-22 01:05 UTC,N/A,false,N/A,
How to Own a Room,"In the long run, commanding a room means making lasting connections and furthering yourself and your business. In this course, business expert Bianca Lager walks you through exactly how to capture everyone’s attention in the room and own your self-confidence. This course is for everyone from employees to CEOs that struggle to make a lasting impression. Learn how to refine certain skill sets to prepare to own a room, establish a strong presence through your appearance and body language, and practice positivity to overcome any fears. By the end of this course, you’ll have the tools needed to make lasting connections in nearly any room you walk into.<br><br>This course was created by <a href=""http://www.onlymadecraft.com"" target=""_blank"">Madecraft</a>. We are pleased to host this training in our library.<br><br><img src=""https://media.licdn.com/media/AAYAAgCwAAoAAQAAAAAAAHppnBQxgeyWS2CsU3aDDPcMgw.jpg"" height=""20%"" width=""20%"">",Course,2021-07-30 17:25 UTC,N/A,true,N/A,
